{
  "schema_version": "1",
  "company_id": "00000000-0000-4000-8000-0000000000a1",
  "correlation_id": "corr-payment-intent01",
  "event_id": "event-payment-intent",
  "idempotency_key": "idem-payment-intent01",
  "payment_intent_id": "00000000-0000-4000-8000-0000000000c1",
  "amount_cents": 15000,
  "method": "pix",
  "status": "created",
  "occurred_at": "2026-09-23T12:00:03Z"
}
